{
  "id": "HLP-335",
  "ledger_locator": "HERMES_LOCAL_PATCHES.md#hlp-335--terminal-pr-references-must-not-strand-graphify-closeout",
  "components": [
    "HLP-335",
    "hermes_cli/kanban_db.py"
  ],
  "required_behavior": "A respawn guard may treat only independently verifiable OPEN pull-request references as active. CLOSED or MERGED references must not strand a legitimate terminal continuation. OPEN, malformed, missing-gh, network/auth, and unknown states remain guarded. Review-lane, auth, cooldown, and recent-success guards remain unchanged.",
  "local_status": "ACTIVE_LOCAL",
  "upstream": {
    "repository": "https://github.com/NousResearch/hermes-agent",
    "inspected_revision": "4f22543509d1b91dc45bcb369447126c5eb14fb7",
    "linked_refs": [
      {
        "kind": "issue",
        "url": "https://github.com/DarkArty07/Aether-Agents/issues/335"
      },
      {
        "kind": "pull_request",
        "url": "https://github.com/NousResearch/hermes-agent/pull/95199"
      }
    ],
    "disposition": "upstream_open",
    "evidence": [
      {
        "kind": "source",
        "reference": "https://github.com/NousResearch/hermes-agent/blob/4f22543509d1b91dc45bcb369447126c5eb14fb7/hermes_cli/kanban_db.py",
        "result": "The inspected inventory revision has no CLOSED/MERGED exemption for terminal PR references in the respawn guard. This inventory record is not a claim that the historical revision is current upstream."
      },
      {
        "kind": "api",
        "reference": "https://github.com/NousResearch/hermes-agent/pull/95199",
        "result": "Still-open upstream PR 95199 proposes a terminal-state approach. HLP-335 adapted that idea locally rather than upgrading Hermes or adding a requeue bypass; no Aether-authored upstream PR was created."
      }
    ]
  },
  "retirement_gate": {
    "summary": "Retire only when a qualified upstream version independently passes terminal/open/unknown/auth/duplicate-link controls and the legitimate continuation canary without this delta. Do not retire merely because an upstream PR merges.",
    "status": "failed",
    "evidence": [
      {
        "kind": "test",
        "reference": "disposable RED/GREEN respawn-guard gate recorded in HERMES_LOCAL_PATCHES.md",
        "result": "Local disposable RED 5 failed / 15 passed; GREEN 20 passed; existing Kanban DB/review suites 51 passed / 1 skipped. Exact public inventory still lacks the CLOSED/MERGED exemption, so the full upstream retirement gate cannot pass on this revision."
      }
    ]
  },
  "artifact_verification": {
    "status": "unavailable",
    "artifacts": [
      {
        "kind": "reconstruction_input",
        "reference": "private exact dirty preimage SHA-256 10d60a61000b02457381cac3de2b202bf5ecc84bff9ad0f52e4f8f35809a1eb0",
        "result": "unavailable"
      },
      {
        "kind": "reconstruction",
        "reference": "installed file SHA-256 159b2b521d5c950c086fffe9c89204d8d1334b72b876e6b2a40078c601747910; exact recovery delta SHA-256 7f971b5f73701ac7903e3ce955c323c263bcd8fa24edbf78b0d7e026026b7adf",
        "result": "passed"
      }
    ],
    "blocker": "No public portable patch exists under patches/hermes. The exact dirty runtime preimage is private and not a public release artifact. Public readers must not infer clean upstream applicability from the recorded hashes."
  },
  "retirement_recommendation": "retain",
  "blocking_uncertainty": [
    "Upstream PR 95199 remains open and is not an exact-revision behavioral pass of this local delta.",
    "No public portable patch is checked into patches/hermes; reconstruction uses a private dirty preimage."
  ],
  "summary": "Retain HLP-335. The local respawn-guard recovery releases only independently verifiable CLOSED/MERGED PR references so Graphify closeout can resume; OPEN/unknown/auth failures stay guarded. This records a downstream repair, not a Hermes upgrade or a Graphify product delivery."
}
